title,reviewer,travel_root,text,flight_type,rating,travel_date,reviewed_Date,Legroom_rating,Seat comfort_rating,In-flight Entertainment,Customer service,Value for money,Cleanliness,Check-in and boarding,Food and Beverage
Poor staff communication. No staff available or willing to help in dom lounge. 6 and 1/2 delay,Trip13130450343,New Delhi - Goa,"Staff at check in counter won't tell you, you have a delay, once your hold baggage goes down you can't get it back to change flight. Staff at counter unhelpful.",Domestic,2.0,January 2024,19 January 2024,3.0,3.0,1.0,1.0,3.0,2.0,1.0,2.0
Worst service.. delayed service,Navigate32524530523,Pune - Bengaluru,"Flight was delayed for more than 3hrs, worst service. Pls do not travel.

Every hr, announce delay MSG, worst sevice ever

Do not ever travel in Air India express",Domestic,1.0,December 2023,19 January 2024,1.0,1.0,1.0,1.0,1.0,1.0,1.0,1.0
Not good,GoPlaces56303004811,Imphal - Bengaluru,My trolley was fine and new but one ground staff came and reported that my trolley didn’t have one wheel. It broke because of their carelessness. Please do take care of the things. We can’t just repair everything for whatever you damaged.,Domestic,1.0,January 2024,15 January 2024,N/A,N/A,N/A,N/A,N/A,N/A,N/A,N/A
I5-736- dated 15 Jan 24- Diverted to Jaipur instead of Delhi and no assistance thereafter,Vaibhav J,Pune - New Delhi,"Hi All,

Today’s my complete family travelled with Air asia flight from Pune to Delhi and flight is diverted to Jaipur instead of Delhi.

Its been more than 7-8 hours now , my wife with kids and infant are struggling on the Jaipur airport without any assistance from Air India Express.

My wife and i tried calling AirIndia express from last 7-8 hours but no one is assisting us expect their non sense Tia( chatbox).
We are still waiting helplessly at Jaipur AirPort.

POOR SERVICES OF AIR INDIA EXPRESS",Domestic,1.0,January 2024,14 January 2024,1.0,1.0,1.0,1.0,1.0,1.0,1.0,1.0
Worst flight!!!!!,Discover04510223009,Bhubaneswar - Bengaluru,"Did not get water when asked untill I had to press the bell for assistance.

Pathetic situation- Flight did not land in Bangalore owing to minimum fuel. Why was the procedure not checked before boarding the passengers.
We flew to Chennai to refuel.

Staff behaviour was not good, was knocked twice on the lavatory while peeing.
No complimentary snacks offered to passengers which included kids and old age people too.",Domestic,2.0,January 2024,13 January 2024,1.0,1.0,4.0,1.0,1.0,3.0,2.0,2.0
Poor service,Voyager13603808779,Kochi (Cochin) - Bengaluru,The Air India express flight time got rescheduled 3times n they even changed our connecting flight timing without informing …the title “express” is  namesake only .poor very poor in professionalism,Domestic,1.0,January 2024,13 January 2024,1.0,1.0,1.0,2.0,1.0,2.0,1.0,1.0
Trash Airlines,Wander04097492048,Hyderabad - Thiruvananthapuram (Trivandrum),"Poor management, Delayed 8 hours, congested seats, Slow and lazy service, inexperienced staff. Overall bad experience",Domestic,3.0,December 2023,12 January 2024,2.0,1.0,1.0,3.0,1.0,4.0,1.0,3.0
Was very hungry and my further plans were to be cancelled,Traveler01166588956,New Delhi - Bengaluru,"The flight and connecting flight I5 975 was delayed, disturbing our plans. When unduly delayed, they could have served some food. The Aiport shops loot the passengers with 1:20 price…",Domestic,1.0,December 2023,12 January 2024,4.0,4.0,1.0,5.0,2.0,3.0,1.0,1.0
Very bad flight.,safira25,Kochi (Cochin) - Bengaluru,"I had a stop over flight and both flights were delayed causing a lot of inconvenience for me and my family and nothing was done about this. The air hostess customer service was very horrible and refused to give us food even though my child was crying, it was a horrible experience overall.",Domestic,1.0,December 2023,12 January 2024,1.0,1.0,1.0,1.0,1.0,3.0,3.0,1.0
Worst experience,Mahesh,Bengaluru - Thiruvananthapuram (Trivandrum),"They will send flight reschedule message and confuse the passengers in last moment. My flight was postponed , then preponed, but in actual it was delayed  and for more than 2 hours . I assume they also don’t know when exactly their flight is going to arrive or depart. :)",Domestic,2.0,December 2023,12 January 2024,N/A,N/A,N/A,N/A,N/A,N/A,N/A,N/A
Worst flight service ever,Odyssey45712549538,Bengaluru - Jaipur,"Worst flight service. Always delay on the last moment. Even if you pay for connecting flight, they will cause inconvenience to you by providing you connecting flight at the last moment.
I wonder how this airlines could do such things for their benefits and causing trouble to the passengers.",Domestic,1.0,January 2024,12 January 2024,N/A,N/A,N/A,N/A,N/A,N/A,N/A,N/A
Bad experience,SPAIC,Bengaluru - Mangalore,Booked air India express thinking it’s with Tata and service would be better. The flight delayed multiple times actually they advanced and then postponed the timings. What a mess also they call you 10 times if there is a change. I feel Indigo is far better at least the flights are on time. Will not travel again in Tata Air india express,Domestic,2.0,January 2024,12 January 2024,3.0,3.0,3.0,3.0,3.0,2.0,1.0,2.0
A useless experience,radhikap04,Bengaluru - Hyderabad,"The flight has been delayed for over 3 hours and I get an email from the airlines 5 hours in advance. While Air India Express is never on time, this is the second time I have experienced a delay of over 3 hours. I will never book on this airline again. So fed up!",Domestic,1.0,January 2024,11 January 2024,N/A,N/A,N/A,N/A,N/A,N/A,N/A,N/A
Please don't choose Air India Express,Companion52267773987,Bengaluru - Hyderabad,"Poor response
Poor service 
I never expected from Tata Group from this 

No matter how big you are 
Your team don't know how to respond to Passenger who is travelling from your Air India Express Flight 

No point of running show here 

Worst experience I never had in my life",Domestic,1.0,December 2023,11 January 2024,1.0,1.0,1.0,1.0,1.0,1.0,1.0,1.0
Work flight please do not travel,Wander13891796197,Hyderabad - Jaipur,"Worst flight they delayed for bloody 1:40 mins stupid people poor management
First experience and last experience for sure",Domestic,1.0,January 2024,11 January 2024,N/A,N/A,N/A,N/A,N/A,N/A,N/A,N/A
Worst experience,Tourist62892380337,Bengaluru - Guwahati,"Worst journey ever with Air India Express. We were late by 5 mins for boarding due to natures call (at the wrong time) and the ground crew who stands near boarding gate called us just 2 mins before and told us that they are closing the gate. We apologise and asked her to wait and the moment we reached the boarding gate, she handed over some paper to me and asked me to give it to cabin crew. Her name and number according to true caller- Vamsi Reddy- 9398604264. We are thankful that she waited but handing over her work is not okay. It was her duty to wait till the fight time and hand over the paper herself. How come she asked a passenger to do her work. 

After reaching our seat, none of the air hostess greet us or helped us. Okay no problem, greeting is not required but atlst they should help us. They were standing there and mocking us. Flight no I5 1529 on Jan 6, 2024 at 2:55pm from Bengaluru to Guwahati. 

Really bad experience. I hope this airlines discontinue. Seats were terrible with no leg space. Terrible service and staff.",Domestic,1.0,December 2023,10 January 2024,1.0,1.0,1.0,1.0,1.0,1.0,1.0,1.0
Worst service,NorthStar14154640570,Mangalore - Mumbai,"Pathetic service, Delayed flight,
No proper communication and received damaged luggage… no response from customer service",Domestic,1.0,January 2024,10 January 2024,1.0,1.0,1.0,1.0,2.0,1.0,2.0,1.0
Never risk yourself,vanasuma17,Mangalore - Bengaluru,"Had a worst experience in my flight journey with air india express. Morning travelled from Blore to mlore . Until the said time it shows on time and suddenly they make us wait and 35 min late the flight took off. I was late to my meeting.
Again same day travelling bk to Blore from mlore and same reoccurs. Until 8.15 boarding time they wouldn't say anything after that they make us stand in the line for 25 min and say flight is getting cleared. Worst staff, no ethics and absolutely unhappy",Domestic,2.0,January 2024,9 January 2024,3.0,3.0,2.0,2.0,2.0,3.0,1.0,2.0
3rd place in a 2 horse race.,Compass27833695357,Bengaluru - Pune,Air India Express has always been poor but with the integration with Air Asia its an absolute disaster and they need to sort out the mess they've created.,Domestic,1.0,January 2024,8 January 2024,2.0,2.0,1.0,2.0,3.0,2.0,1.0,1.0
Worst ervice,Connector57895910978,Mumbai - Jaipur,"Our luggage was damaged and no staff attended nor compensated for it, flight was delayed and veruly bad service with huge cost",Domestic,1.0,December 2023,8 January 2024,N/A,N/A,N/A,N/A,N/A,N/A,N/A,N/A
Worst experience will never travel Again in this flight,dream a,New Delhi - Sharjah,"I am writing this review from flight which was supposed to take off at 8:20am and now it’s 11am and we are still at delhi airport. Firstly they said it’s technical issue, then ATC stopped us and finally refueling. When all the passangers asked them they said vl take off in 15-20 mints which alreay passed half n hour ago and now god knows when are they going to take off and if take off will reach safely to our destination or not.",International,1.0,January 2024,7 January 2024,N/A,N/A,N/A,N/A,N/A,N/A,N/A,N/A
Getting refund back,Compass50332937512,Amritsar - Sharjah,The flight has to be fly over on time 7:50 and I go inside the airport on 7:10 and the boarding pass counter has been closed they said that time is over and you have not allow to go inside and they send us back so want my refund of the ticket the ticket price is 22008 INR rupees my ref no.A0233065646 so pls tell me that how can I get my refund the date of my flight is 5-jan-2024 of sharjah,International,3.0,January 2024,7 January 2024,N/A,N/A,N/A,N/A,N/A,N/A,N/A,N/A
AirportStaff very rude,Fearless03840383706,Lucknow - New Delhi,"Staff was very rude, not supporting,  worst service, bad experience, air india express flight very bad",Domestic,1.0,December 2023,7 January 2024,N/A,N/A,N/A,N/A,N/A,N/A,N/A,N/A
Thank you Mr. Sanjeeth Kumar,Sunshine37210265514,Abu Dhabi - Kozhikode,"Being a flight attendant is a great job, but it’s not always easy! Dealing with delays, cancellations, and irate passengers can definitely test your patience , I just noticed throughout my journy Mr. Sanjeeth Kumar who help me all the areas which is I missed , thank you Mr. Sanjeeth , it’s apreciatable ..!!",International,5.0,January 2024,6 January 2024,N/A,N/A,N/A,N/A,N/A,N/A,N/A,N/A
Worst airline ever,Dreamer10633348197,Bengaluru - Ranchi,"Worst service , worst airline
I won’t need recommend this flight even to my enemies , bad service ..",Domestic,1.0,January 2024,5 January 2024,1.0,1.0,1.0,1.0,1.0,1.0,1.0,1.0
Bad,Eldhose A,Kochi (Cochin) - Sharjah,"While travelling, the ground dutystaff misbehaved and I raise a complaint but no action against it..",International,1.0,November 2023,5 January 2024,N/A,N/A,N/A,N/A,N/A,N/A,N/A,N/A
Nothing,DayTrip66693335375,Kochi (Cochin) - Sharjah,Your luggage reception mis Kavya behavior is not good . She doesn’t have any manners how to behave passengers.,International,1.0,December 2023,5 January 2024,N/A,N/A,N/A,N/A,N/A,N/A,N/A,N/A
The worst decision of my life to book air india express to and fro,Vishnu Satis,Bengaluru - Thiruvananthapuram (Trivandrum),"The worst experience I have ever had in a flight journey.
First of all the flight was delayed by 3 hours atleast. Unfortunately i hate to say that, thats not the worst part.

I can understand that flights can get delayed due to safety reasons and unprecedented scenarios, but the communication from the ground staff was pathetic.
We were sent to flight through the walkway/bridge, and they made us to stand there for 30 mins without giving a reason. There were passengers holding babies and old people too. Until the passengers started protesting, no body even cared to take any steps any further steps, but just to make us wait. If it were upto the ground staff we would have been standing there god knows how much.
After telling us that they cant board ua , they were also not able to take ua back to the waiting area, now we are sitting on ground, enough people to fill a flight all sitting on ground. Then they made us to finally go to waiting area on the other aide of the gate, but after making us sit on the floor for another 30 mins, but through transfers gate, were we had to go through security check again. 

Secondly nobody was given proper briefing  about what the procedure for second time security check was and how to navigate through the situation and which terminal to reach. We told by the security at the check that we cant go in with old boarding pass. After 15 mins of confusion a staff made us go through the security check gate, with old boarding pass. 

After all this when we reached the gate, nobody new at the gate about thia incident, they are confused and making calls, and there was another delay of 2 hours. Finally we reached trivandrum at 3 am. Instead of 11.

To the common man, please dont book this flight of any of the flights from them. 

To air india, Please hire some competent ground staff or passengers are going to be pissed. In flights delays constant communication with the customer is a must.

Note:
Am writing this sitting in the trivandrum airport waiting for the return flights, and as you might have already guessed, its delayed.",Domestic,1.0,December 2023,3 January 2024,3.0,3.0,1.0,1.0,1.0,3.0,1.0,1.0
Worst experience,Daydream60082156487,Bengaluru - Kolkata (Calcutta),"Worst possible service,even after air india acquired it, no improvement in service,don't ever book their flights",Domestic,1.0,January 2024,2 January 2024,N/A,N/A,N/A,N/A,N/A,N/A,N/A,N/A
Pretty bad,SudipK,Kolkata (Calcutta) - Bengaluru,"Flight is delayed by 2-3 hours almost everyday. Horrible Airline, they have shortage of planes and delays are happening due to that",Domestic,1.0,January 2024,1 January 2024,N/A,N/A,N/A,1.0,N/A,N/A,N/A,N/A
Harassment by Manas Gulati ground staff,Nomad30053095914,New Delhi - Bengaluru,"Staff very rude. Manas Gulati  ground staff at Delhi Airport should be chucked out from the airlines. On account of harassment and humiliation causing mental agony to female passengers, and got to know earlier also people have complained against him but he escapes all the time.
Request to the owners to please take action against him rigorously, he us spoiling companien’s name.",Domestic,2.0,January 2024,1 January 2024,1.0,2.0,N/A,1.0,2.0,3.0,1.0,2.0
Hopeless,GletaRods,Goa - Mumbai,They are not ready to adjust check in weight with hand luggage. If a family is traveling they expect each handbag to be 7 kg only. I probably feel as a family the total weight can be considered but they have no consideration.,Domestic,1.0,December 2023,31 December 2023,N/A,N/A,N/A,N/A,N/A,N/A,N/A,N/A
Air India sucks,Culture52305572942,Guwahati - New Delhi,Flights are ALWAYS delayed. Plus they aren’t professional at all! I’ve always had a bad experience with Air India.,Domestic,1.0,December 2023,31 December 2023,1.0,1.0,1.0,1.0,1.0,1.0,1.0,1.0
Charged for laptop weight even though the law says laptops aren’t included in the 7kg cabin luggage,Roam44223055027,Bhubaneswar - Kolkata (Calcutta),"I got my boarding pass with no problems but then when I was heading towards the security, a guy from air India express asked me my airline and then asked me to weigh my cabin luggage and laptop. 

It exceeded the 7 kg but as laptop weight shouldn’t be included in this allowance, I thought it’s okay to exceed. However, even after showing them on Google on air India express own website, they still forced me to pay extra for crossing this 7kg weight limit. My pnr was E4KRTW. Moreover, I had a surgery and I requested them it would be a hassle for me to again go through the long queue and pay but they refused to help. 

They even told me that the flight is completely booked so we can’t allow a single kg extra and then when I boarded the flight, I was surprised to see no one sitting beside me and there were so many empty rows. The most empty flight I had seen in my entire life. I think that’s why they were trying to make up for their losses.

I would only go with this airline if I have no other options. Pathetic. Wouldn’t recommend.",Domestic,1.0,December 2023,30 December 2023,1.0,2.0,N/A,1.0,1.0,1.0,1.0,1.0
Horrible service,Curious30698771596,Bengaluru - Thiruvananthapuram (Trivandrum),Worst possible experience in an airline. Made us wait for half an hour in the sky bridge and then told us flight is delayed . People were literally sitting in the floor. Then made us( every single passenger ( go through the entire  security check in again under the pretext of requiring a new boarding pass. Never trust this airline,Domestic,1.0,November 2023,29 December 2023,N/A,N/A,N/A,N/A,N/A,N/A,N/A,N/A
Horrible experience,DayTrip12929071708,Varanasi - Pune,"Experience was horrible, flight was delayed multiple times. Better to plan in train in case you wouldn't get any flight except air india express.",Domestic,1.0,December 2023,27 December 2023,2.0,2.0,1.0,4.0,1.0,3.0,3.0,1.0
Worst experience,Paradise67972518794,Kolkata (Calcutta) - Kochi,"I have been traveling with indigo for very long.But since it was holiday season indigo was full, instead I booked air India express.i reached the airport on time but there was a que at the entrance of the airport and when I got in it was 45mins to the flight but the staffs were not allowing me to check in saying it's closed.They didn't even try to help even a bit. This being a morning flight they could atleast make me check in and then I could atleast try to see if I could have boarded the flight which I would have definitely since there was enough time. There is zero customer care. The guy sitting on the desk was just being a jerk probably because I'm a woman and it was just one ticket.",North Asia,1.0,December 2023,26 December 2023,1.0,1.0,1.0,1.0,1.0,1.0,1.0,1.0
Fraud.,Freedom47273889298,New Delhi - Srinagar,"This airline and the employees working over there are fraud. I was 50 min early for my flight but they denied my checkin, sighting I’m late for the boarding as the gates gets closed 50 min before departure . They were not ready to even listen to our problem. We literally begged them for checkin as we knew the boarding was possible, but they didn’t care to help. Eventually we paid 31k extra by booking another flight. And to our surprise we got to know that we were on time but due to carelessness and ruthless behaviour of staff we got cheated.",Domestic,1.0,December 2023,26 December 2023,1.0,1.0,1.0,1.0,1.0,1.0,1.0,1.0
Worst airline company,NorthStar24506800337,Bengaluru - Pune,The worst service of Air India express. It's not worth to book with the flight don't waste money as well as time in air india express. Everytime flight got delayed for 2 3 hrs even though the flight is delayed they will not provide you anything. It's not acceptable at all. Never fly with air india express you can pay some extra penny for any other aircraft company but dont choose the air india express and if you are planning to go with the same then reschedule your next days tasks because they will not land you in desired time don't trust anymore.,Domestic,1.0,November 2023,26 December 2023,1.0,1.0,1.0,1.0,1.0,3.0,1.0,1.0
Terrible travel experience with Air India Express,Sunshine07546122186,Hyderabad - Bengaluru,"Very bad experience traveling by Air India express. I was traveling with a senior citizen and booked flight at a convenient time in the evening 7 50 , so that I can reach home at a reasonable time as I'm put  up around 40 KM from airport. The flight was delayed ~ 3 hours as of which , the arrival time would cross mid night. After lot of persuasion and follow up , they ended up accomodating in a different flight , which also was delayed royally by 40 min , and eventually ended up arriving closer to mid night. This is a very bad experience  and I would highly recommend not to travel by this air lines. Extremely inconvenient operational airline procedures , who are least bothered about passengers.",Domestic,2.0,December 2023,26 December 2023,2.0,2.0,1.0,1.0,1.0,2.0,2.0,2.0
Try not to use single use plastic bottles.,Happiness05306491053,Bengaluru - Visakhapatnam,"It was a lovely flight. However, I couldn't help but notice that they provided water in plastic bottles. As we move towards a sustainable future, it would be great if our airlines can also work towards being sustainable. It would be great if you could use paper cups or any other alternatives instead of single use plastic bottles.",Domestic,4.0,December 2023,26 December 2023,5.0,5.0,4.0,3.0,4.0,4.0,4.0,4.0
Worst checkin experience,Rakesh RajanM,Thiruvananthapuram (Trivandrum) - Bengaluru,"I’m a regular traveler, but this check in experience was horrible, no proper guidance and 
Those who are waiting in the queue they will treat like fools, if u have personal connections with the staffs then no need to wait in the queue and when I have asked them to talk to the manager surprisingly no manger was on duty.",Domestic,3.0,December 2023,25 December 2023,3.0,3.0,1.0,3.0,2.0,3.0,1.0,3.0
Maharaja still hasn't arrived,Odyssey58012105278,Mangalore - Bengaluru,"Pathetic service..no proper announcement, delayed flights, seats uncomfortable..can go on with a lot more",Domestic,1.0,December 2023,25 December 2023,1.0,1.0,1.0,1.0,1.0,1.0,5.0,1.0
I rather take a bus than fly this crappy airline.,uday029,Bengaluru - Hyderabad,"Avoid at all costs, even when Air India Express (AIE) costs 40%-50% less compared to other airlines. This is the worst airline for any domestic travel within India. They run the same one flight between various cities through out the day. If the first flight is delayed then all the subsequent flights see exponential delays. Even in case of general airport related delays, AIE gets the least priority among all other airlines. So if there is a weather related delay, all other airlines still experience lower delay than AIE. 

Their customer service is non-existent. If by a miracle, you get a hold of a human representative, they just repeat the information that one can find online. They are east bothered to help the passenger. Avoid this airline if you value your time. 

The fleet is quite old with wear and tear clearly visible. Many things inside the flight are held together by duct tape (such as hand rests, sliced seat cushions etc). The flight itself is very dirty due to its old age. These guys cram as many seats as possible so the legroom is pathetic. If you are anything above 5 ft 5 inches then you will have a hard time sitting comfortably. There are no seat cushions.... well, there are colored things on seats but I doubt they qualify as ""cushions"". It will feel like one is sitting on couple layers of  cardboard.",Domestic,1.0,December 2023,23 December 2023,1.0,1.0,1.0,1.0,1.0,1.0,2.0,1.0
Bad experience with Air India Express,Ashutosh S,Pune - Bengaluru,"Being a first timer having a pathetic experience. I will never recommend Air India Express. The flight delayed by more than two hours. Multiple time flight timings changed... actual time was 11:40PM then it got changed to 12:35AM, again 1:15AM and now 1:50AM. I am at gate and expecting at this time they will not revise..",Domestic,1.0,December 2023,23 December 2023,2.0,2.0,1.0,1.0,1.0,2.0,3.0,1.0
Worst communicator air line,Wander39847748492,Bengaluru - Thiruvananthapuram (Trivandrum),"Typical south India as expected behaviour.  Worst communication from the air line. Our family flight was delayed by the 5 hours but no announcement and no communication. No apology, no regret or acceptance of their behaviour.  The staff disappear from the counter to avoid the heat from the customer.  So much losses i will have to bear due their incompetent staff. The customer need to cash them for update.  They change the gate and again no communication or announcement.  They expected that the customer who flight is delayed will be able to keep their eye and ear opened whole night and chase them to find out when is the flight leaving. I will never again fly this airline.  Probably last trip in the south India as it feels that they are not welcoming people.",Domestic,1.0,December 2023,23 December 2023,N/A,N/A,N/A,N/A,N/A,N/A,N/A,N/A
Air India Express… never!,sangeeta s,Amritsar - Dubai,"The flight has been delayed for 18 hours with no prior notice and after checking in and after immigration! 
The staff refuses to clearly tell the passengers the reason for the delay. They show so much attitude as if they’re taking us on board for free! 
I would never recommend this airline!",International,1.0,December 2023,21 December 2023,N/A,N/A,N/A,N/A,N/A,N/A,N/A,N/A
Experience,Scenic50179265891,New Delhi - Bhubaneswar,"Useless airlines..worst airline ever. Starting from service ,seat arrangements .worse. strong NO for all. Don't ever consider this airline to travel anywhere.",Domestic,1.0,December 2023,21 December 2023,1.0,1.0,1.0,1.0,1.0,1.0,1.0,1.0
Best customer  service,Arun venu,Srinagar - New Delhi,I had very good experience  from ground staff Asima?Asifa at check ✔️  in counter @Srinagar  airport; very friendly  and very professional  and helped me with my queries with ease  and also flight and cabin crew experience  was also  very good,Domestic,5.0,December 2023,20 December 2023,N/A,N/A,N/A,N/A,N/A,N/A,N/A,N/A
