title,reviewer,travel_root,text,flight_type,rating,travel_date,reviewed_Date,Legroom_rating,Seat comfort_rating,In-flight Entertainment,Customer service,Value for money,Cleanliness,Check-in and boarding,Food and Beverage
Forcibly charging for a seat,Deepjyoti B,Dibrugarh - Bengaluru,"Airport team charged extra for the seats saying i have not booked the seats.
My questions is when i book a flight ticket technically am i not also booking a seat ?then why was i asked to pay extra for the seat.
When i asked for a free seat it was denied and in hurry were made to pay for the seat.

This is something against our will. No airlines charges extra unless it is a preferred seat.",Domestic,3.0,February 2025,12 February 2025,2.0,2.0,1.0,1.0,1.0,3.0,1.0,3.0
Lovely Journey by Air India express,MOHAMMAD Arshad Ali,Mumbai - Kuwait City,"I had a travel with Air India express twice in month of January and February by IX266 and IX 265...
I had a good experience on board.  Crew was polite. I had a very smooth check in. 
.
THE WORST THING I DIDN'T LIKE ...that is my luggage handling by your team.  When I arrived in Kuwait.    Once I got my luggage.  I have seen.  There is 1 wheels are missing..and handle are damage... because of this. I suffer.

But it's fine .  
I would like to request to your team to if they can do it better. So the customer will be Soo happy..

I had enjoyed my journey.. from check.in to onboard to arrive....

Thank you Air India express for such a wonderful experience..
I will always travel with this air line ...one of my very comfortable Air line ..

Thanks to captain to crew.  To ground staff .
They all are amazing 😍. 
All the best..",International,5.0,February 2025,12 February 2025,4.0,5.0,N/A,5.0,5.0,5.0,5.0,5.0
Scam Flight,Karan T,Dubai - Amritsar,"Horrible experience with weights at the counter they let go 1kg of my brother but when they found out we are together they tried charging us X3 extra for duty free products. The guys name was Syed,  Its a total scam when your boarding.",International,1.0,February 2025,10 February 2025,N/A,N/A,N/A,N/A,N/A,N/A,N/A,N/A
The extreme worst does exist,Jawad A,Kannur - Kuwait City,The worst service in the Airport. The people would be much happier if they shut down. The way they treat people is so bad that it only exists with this people. Even the worst of the worst is better in comparison. Cant want for these bigots to be treated the way they treat people. Would never recommend anyone to use this bad airlines. Better walk to ur destination than to use this service. Thuuh. On the face of these staffs in the airport,International,1.0,November 2024,9 February 2025,N/A,N/A,N/A,N/A,N/A,N/A,N/A,N/A
Terrible,Francisco A,Mumbai - London,Very bad service condition of the flight is bad we got broken seat no tv screen is working this will be my last n final with AIR INDIA flights I suggest pay little bit more money n choose other flights,International,2.0,February 2025,8 February 2025,1.0,1.0,1.0,1.0,1.0,1.0,1.0,2.0
Air India Unexpress,Pioneer02301243526,Mangalore - New Delhi,"As an international traveler, I’ve just concluded a month in India, and I must say, I've never experienced such a disastrous episode in my air travel history. @AirIndiaX, your staff at IXE Airport—specifically Ibrahim Khalil and Anupama V—displayed an utter lack of professionalism and training. I was subjected to unnecessary harassment over a few extra kilos, all while being treated with an unmistakable lack of courtesy. This level of unprofessionalism is unacceptable and not what any traveler should ever endure. I expect a higher standard from an airline of your stature.",Domestic,1.0,January 2025,8 February 2025,N/A,N/A,N/A,N/A,N/A,N/A,N/A,N/A
Good,Arshima A,Kozhikode - Muscat Governorate,"The recent experience with Airindia cabin crew was extraordinary, specially Ms.priyanka guptha her way of communication, gesture caring, explanation everything was superb.travelling alone with my 5month old baby was tough for me.thanks to Ms.priyanka for making my fly comfortable.",International,4.0,February 2025,7 February 2025,N/A,5.0,4.0,5.0,3.0,4.0,3.0,4.0
Worst airline,Bike R,Kozhikode - Dubai,Worst flight in the world. Changing tbeir policy day by day. Staffs are so errogant. They making india name bad by putting air ondia express. Change name to something else,International,1.0,January 2025,7 February 2025,1.0,1.0,1.0,1.0,1.0,1.0,1.0,1.0
Bad experience,Tourist48021891846,Agartala - Singapore,"It my second time to travel with air india express and  if the flight was miss e.g from Chennai, Guwahati and dehli. You miss in Chennai you came in Guwahati to same flight but staff will say it if miss the flight mean u have to book a new ticket",Southeast Asia,1.0,February 2025,7 February 2025,N/A,N/A,N/A,N/A,N/A,N/A,N/A,N/A
Never to fly Air India Express,Sharad S,Pune - Lucknow,On the 1Feb and today 7Feb on both days this rotten airline would announce delays in 2 hour increments. My Spouse travelled by the same flight ETD 17.40 and every hour they would announce an hour delay for operational reasons Aircraft are not Ambassador cars that keep breaking down. So the. airline know the extent of delay but the keep the information from customers and needlessly inconvenience them.. WE HAVE PROMISED OURSELVES THAT WE SHALL NOT TRAVEL BY AIR INDIA EXPRESS EVER. The mot rotten Airline,Domestic,1.0,February 2025,7 February 2025,N/A,N/A,N/A,N/A,N/A,N/A,N/A,N/A
Worst airline in india,Mridula S,Goa - New Delhi,"Worst airline from india , never travel and do booking of this airline

We suppose to fly from air india express last night but due to an emergency we couldnt fly and tried to call them ahead of their 2 hours reschedule time frame but no answer and couldnt do so.

After multiple attempts finally one of there crew answered and rather than assisting us, he kept threatening to disconnect the call and finally hanged up saying its not his problem

Now we know why indigo is a better option for travellers within india and not ever book air india , air india express or any of their alliance 

#boycott airindia express",Domestic,1.0,February 2025,6 February 2025,N/A,N/A,N/A,N/A,N/A,N/A,N/A,N/A
Scam airlines beware,Shibajyoti D,Kolkata (Calcutta) - Agartala,"Terrible service, they weigh both carry on and personal item and charge exorbitant amount of money for extra weight. I have travelled all around the world and no airlines weigh both carry on and personal item. The ground staff are extremely unprofessional.",Domestic,1.0,February 2025,5 February 2025,1.0,1.0,1.0,1.0,1.0,1.0,1.0,1.0
Air India Express shenanigans,Mr. Napi3r,New Delhi - Guwahati,"Boarded a flight from New Delhi to Guwahati but our entire luggage was missing on arrival. The ground staff was absolutely uncooperative and aloof. They had the audacity to shrug off all responsibility and instead made us feel that we were the ones being unreasonable.
On top of all that, the cabin crew arrived almost 45 minutes AFTER the final boarding of all the passengers!
Neither the cabin crew nor the ground staff were cordial or helpful. Needless to say it’s going to take me a thousand considerations before I book another flight with Air India Express!",Domestic,2.0,January 2025,5 February 2025,3.0,3.0,1.0,1.0,1.0,3.0,3.0,2.0
Worst airlines,ananthu t,Dubai - Thiruvananthapuram (Trivandrum),"Worst airline operating in middle East. Hardly they keep the time..if delayed..no explanation, no compliments. Seating and space terrible. They are strictly only on one area . .. baggage weight..not even accomodate duty free items.. If not with comparable low price for ticket.. the airline would have shut down....it's a good example how an airline should not be.",International,1.0,February 2025,5 February 2025,1.0,1.0,1.0,1.0,3.0,2.0,1.0,1.0
Rude staffs,Roam55578307570,Bengaluru - Dimapur,"Worst behaviour from staffs ,, I had  book flight tickets for 3 persons which costed me 27k n reached there before an hour by that time the baggage counter was already closed so we requested the lady who was in the counter that we don’t need the baggage just let us board the plan she didn’t say anything n just took us out the she took our names after that she told us to book the next flight ,, we requested her many times but she didn’t said anything n kept telling us to book the next flight ,, very poor helping the customers  n worst experience never travelling with this airline again",Domestic,1.0,February 2025,5 February 2025,N/A,N/A,N/A,N/A,N/A,N/A,N/A,N/A
Worst,Mobile63007911997,Hyderabad - Visakhapatnam,Worst flight.. yesterday 9pm  my journey.. today mrng 9:30 .. still now the flight did not moved.. please don’t book the tickets in air India express,Domestic,1.0,February 2025,4 February 2025,N/A,N/A,N/A,N/A,N/A,N/A,N/A,N/A
Disappointing Experience with Air India Express,Wander49072723819,Chennai (Madras) - Pune,"I booked an Air India Express flight scheduled for 8:50 PM, expecting to reach Pune by 10:30 PM. Despite the higher fare, I chose this flight because I wanted to reach home early. However, without any valid reason or prior communication, the airline delayed the flight by nearly 2 hours.

Such unprofessionalism is unacceptable, especially when passengers are paying a premium for convenience. There was no proper explanation or assistance provided during the delay, making the experience even more frustrating. Definitely not the level of service one expects!",Domestic,2.0,February 2025,4 February 2025,N/A,N/A,N/A,N/A,N/A,N/A,N/A,N/A
Very very Bad service by Air India express- delayed / cancelled flights / no refreshments,Trainer John,Kozhikode - New Delhi,"Most pathetic airlines and handling staff …. At Kozhikode airport … 

1. Flight got cancelled , revised flight at 9 am to bangalore for delayed , revised flight may be at 1400 hrs …. These guys just harass passengers …. Don’t ever try air india express ..",Domestic,1.0,February 2025,3 February 2025,1.0,1.0,1.0,1.0,1.0,3.0,3.0,1.0
Rude n unhelpful non empathic crew over charged which was not at all required,Trip61144583180,Jaipur - Hyderabad,Worst worst worst experience very rude n unprofessional unempathic staff overcharged us 4000 rs for a single bag which was not required with threatening that if not paid all 5 will be u boarded including my 6 years old adhd autistic son requested so badly having 35 kgs still left on hand bagge still charged very upset show some humanity,Domestic,1.0,January 2025,3 February 2025,N/A,N/A,N/A,N/A,N/A,N/A,N/A,N/A
DUE TO GSN NO WHICH NOT VALID IN UAE UNABLE TO BOOK TICKET,AL MADINAH I,Dubai - Male,AIRINDIA EXPRESS TIA CHAT IS ONE OF WORST SERVICE. ZERO STAR.INSTEAD THEY TO TAKE CUSTOMER QUESTION BY EMAIL. I AM TRYING TO BOOK TICKET DUE TO GSN NO WHICH NOT VALID IN UAE UNABLE TO BOOK TICKET.,International,1.0,February 2025,3 February 2025,N/A,N/A,N/A,N/A,1.0,N/A,N/A,N/A
Thank my lucky stars that I don't have to use AIX more than twice.,Aakash P,Jaipur - New Delhi,"The website experience is bottom of the barrell - all fancy looking but across the board terrible. Looks like $0 invested into website's testing to ensure that things work. 
2/10 times, the PNR and last name doesn't fetch the booking. 4-5/10 times, the OTP takes so long that the time expires or it doesn't come at all. 9/10 times, something or the other goes wrong and you can't get in and out of AIX website without pulling some hair out. 1 in 10 times, everything works fine so if you had a good experience - congratulations! You've been spared the headache. 

When you get to the actual flight, well, it works! It goes from one place to the other. Doesn't crash, has seats with seatbelts. Not sure about the aircraft maintenance and all that - I didn't see anything wrong so I don't have any complaints. 

BUT THE SERVICE!! I am glad I don't live in India anymore because I travel a lot for work and if I had to deal with this BS on a monthly basis, I will likely die 15 years early from stress.",Domestic,4.0,February 2025,1 February 2025,2.0,3.0,1.0,1.0,3.0,2.0,1.0,4.0
Worst,Curious44516525923,New Delhi - Goa,Pathetic. 9:30 pm flight first rescheduled to 2:30 am then again rescheduled to 1am. And worst of all boarding did not start till 1am since crew had not reached boarding gates. Worst,Domestic,1.0,January 2025,1 February 2025,N/A,N/A,N/A,N/A,N/A,N/A,N/A,N/A
Very bad experience,Curiosity40254628358,Bengaluru - Abu Dhabi,Pls don't book air India express I request you all the worst flight in my life always delay pls book indigo it'd on time always,International,1.0,February 2025,1 February 2025,1.0,1.0,1.0,1.0,1.0,1.0,1.0,1.0
Delayed flight + missed connection,gaya3,Pune - Kochi (Cochin),"Terrible customer service and communication about delayed flight. Booked a round trip from Kochi to Pune and both flights were delayed by at least 2 hours. On top of the delay, missed the connection in BLR for my Pune to Kochi transit and was never compensated for this. Instead they booked me on a flight almost 12 hours later from Bangalore to Kochi. I had to stay in Bangalore airport for almost 12 + hours waiting for this next transit flight. The delay and missed connection was never communicated to us properly (no text message or calls or emails). Contacted them multiple times for this compensation for the inconvenience caused but they replied only with apologies and no compensation.",Domestic,1.0,January 2025,30 January 2025,N/A,N/A,N/A,N/A,N/A,N/A,N/A,N/A
Delayed service,Mubeen M,Abu Dhabi - Kannur,"It's disappointing to hear that Air India Express seems to have a lack of regard for customers' time, which is a crucial aspect of any airline's service. Delayed flights, poor communication, and inefficient operations can cause significant inconvenience to passengers, and it's essential for airlines to prioritize punctuality and customer satisfaction to maintain a good reputation and build trust with their customers.",International,1.0,January 2025,30 January 2025,N/A,N/A,N/A,N/A,N/A,N/A,N/A,N/A
A Flight to Forget: My Appalling Experience with Air India Express (IX 1331),Venture37794989262,Bengaluru - Hyderabad,"I recently had the misfortune of flying with Air India Express from Bengaluru to Hyderabad (Flight IX 1331) for a corporate visit, and I can confidently say it was one of the worst flying experiences of my life.

Let’s start with the filthy seats—covered in mysterious stains that made me question whether cleanliness is even a concern for this airline. It was absolutely disgusting to witness such negligence from a company that is supposed to prioritize hygiene and passenger comfort.

But the horror didn’t stop there. I had prepaid for a meal, expecting a decent breakfast to prepare myself for the day ahead. Instead, I was left hungry and frustrated, as the cabin crew conveniently decided not to serve it—citing the short duration of the flight as an excuse. So, Air India Express happily takes money for services they have no intention of providing?

This was beyond unacceptable, and I would strongly warn anyone against flying with Air India Express. If this is how they treat paying customers, I can only imagine what other corners they cut. NEVER AGAIN!!.",Domestic,1.0,January 2025,29 January 2025,1.0,1.0,1.0,1.0,1.0,1.0,1.0,1.0
Great experience overall and cooperative staff,Travel34766417378,Bengaluru - Kolkata (Calcutta),The staff was really helpful. Mr. Lenisht helped me alot during the check-in. He made sure I got my preferred seat too :)) thank you so much for all of this.,Domestic,5.0,December 2024,29 January 2025,N/A,N/A,N/A,N/A,N/A,N/A,N/A,N/A
Seat selection  mandatory  charges,Uday S,Kuching - Pune,"I had booked 2 tickets, didn't opt for seat selection, didn't do web check in ,at airport I was told by staff that I have to pay rs450 per seat as seat selection charges,I told them that they can allocate any seat,staff told that without payment they can't print boarding pass.
I hate this kind of extortion.
Web check in also is not allowed unless you pay,then why this feature is there",Asia,1.0,January 2025,27 January 2025,N/A,N/A,N/A,N/A,N/A,N/A,N/A,N/A
Worst experience ever,Climber15423681259,Bengaluru - Dimapur,"Firstly I have reached at the  airport by 3:00am and I went inside directly to check in but My luggage was little bit heavy so I book cap to drop my luggage to my appartment but the security is not allowing me to go out and telling me to go inside and said to air India express staff so I went inside and say to the air India express staff Instead of assorting me they send me again to the security that happen 4 times. What is the point of keeping the ground staff for decoration!! If they cannot help the the customer!
 so  I don't have any option. I check the time it was 4:30 am and I call my friend to pick my luggage but my friend said that to reach airport it will take 
1 hours. I have a flight at 5:30 departure so I please the security to keep my luggage for sometime my friend is coming to collect but they are not allowing me. they keep telling me to go inside and said to those useless staff. finally a girl take me to the security and take me out and I send my luggage to my appartment and I check the time again it was 5:7 am already so I rush inside the airport and give my boarding pass they said that check in time is over so they are not allowing me to go in and I missed my flight. I ask for refund but I didn't get even a penny. I really really regret for choosing this airline air India express worst experience ever in my life and not only that the staff service is zero they don't know how to talk to the costomer and they dont understand what the customer need I never across this kind of service first time in my life",Domestic,1.0,January 2025,26 January 2025,N/A,N/A,N/A,N/A,N/A,N/A,N/A,N/A
Additional luggage and exchange fees too much expensive,Quest33422856071,Goa - Bhubaneswar,"I lost so much money. 

If you want an extra laggage, you will pay 900 rupees just to get an extra laggage and then 7500 rupees for the 15kg weight allowance. 8400 rupees just for adding a 15kg checkin laggage.

Not only this. 

I mistaken the travel dates, took 5 february instead of 5 january. After 2 days I realized and I called back to explain it was a mistake and I asked them if they could please change my dates. They said that more than 24 hours passed so I had to pay the exchange fees. How much? 15000 rupees!! 15000 rupees to exchange the dates of a domestic flight of only 2 hours! I paid less for the ticket itself than for the exchange fees! It was 2 months before departure, so it wouldn't cost them anything. I tried to explain it was a mistake but no help at all. 

I really really really regret that I didn't book an indigo flight.",Domestic,1.0,January 2025,26 January 2025,N/A,N/A,N/A,N/A,N/A,N/A,N/A,N/A
Absolutely horrendous,Ahmad F,Abu Dhabi - Thiruvananthapuram (Trivandrum),"Absolutely horrendous customer service and laggy system, flight delayed 14 hours and won't provide an offload form due to their system showing that I have boarded already, a flight that is cancelled? Stuck at the airport due to their incompetence, please never use this airline, stay away from all air india stuff.",International,1.0,December 2024,26 January 2025,1.0,1.0,1.0,1.0,1.0,1.0,1.0,1.0
Horrible website and service,Go05047953875,Mumbai - Dubai,"Extreme extreme bakwassss cheap and not managed flight service... Every person has 30 kg alloted but they charged us for 50 kg for 3 person... Not cleared instructions on site and real staff both are diff ... Overacting staff... 
Plus their is no option to add infant on website while booking 

So they need to 1st update their site 
Even they are charging where ther ia no need",International,1.0,January 2025,25 January 2025,2.0,1.0,1.0,3.0,2.0,2.0,2.0,1.0
Bad behaviour by staff of Air India Express,OnAir21269004520,Goa - Mumbai,"The flight has extremely poor service.
The most regretful thing about this air lines is the bad behaviour of their staff with customers. Its so bad that even if you ask for a simple help, they will respond in a rude and bad manner to you. They dont seem to care at all about good service to their customers.",Domestic,1.0,January 2025,25 January 2025,1.0,1.0,1.0,1.0,1.0,1.0,1.0,1.0
Best experience,Sightsee59512406689,Varanasi - Bengaluru,"To day me and my brother  checked in at Varanasi airport, travelling to bangalore  the air india express staff Ms. Khushboo Jaiswal and prashanth sing was very kind, helpfull informative, first time I experienced such a wonderful service from the staff of air india express. Keep it up air india express ....",Domestic,1.0,January 2025,23 January 2025,N/A,N/A,2.0,5.0,3.0,3.0,5.0,1.0
Worst experience,GrandTour61809497008,Kolkata (Calcutta) - Bagdogra,"Extremely crampy, no legroom, very poor management plus the worst thing is the flight kept on getting delayed. Our flight was delayed by 2hr40 mins. Like is this a joke? People value time, the airlines may not. Atleast after the takeover of the services by Tata this kind of service was not expected from Air India express!!!",Domestic,1.0,January 2025,23 January 2025,1.0,1.0,N/A,2.0,1.0,4.0,1.0,N/A
Worst experience!!!,Maps48751108539,Indore - Hyderabad,"Okay, so I usually stick to Indigo, but this time I thought, 'Let’s try Air India Express for a change!' Bad idea. Same story—flight late as usual. And you know what? My mom was right. She always says, 'Kisne kaha tha evening flight book kar? Wo hamesha late hoti hai!' Now, I totally get it.

To add to the drama, I left my bag on a seat for a sec, and the air hostess came at me like I was trying to start a 'bag-on-seat' revolution. 'Mam, don’t put your stuff here!' she says, like I’m the first person ever to make that mistake. So, yeah, delayed flights, mom's warning, and a lecture. Classic!",Domestic,1.0,December 2024,23 January 2025,N/A,N/A,N/A,N/A,N/A,N/A,N/A,N/A
Worst Service and Charging extra for luggage,Sowmya K,Jaipur - Hyderabad,"Air India on board service and website web checkin process is worst. Moreover, compared to other airlines they charge more for extra luggage hardly 2 kgs extra than permitted. We had space in hand luggage but they didn’t permit us to do. Never ever opt Air India Express",Domestic,1.0,January 2025,21 January 2025,N/A,N/A,N/A,1.0,1.0,N/A,1.0,1.0
Don’t travel in Air India Express,hiren,New Delhi - Goa,"Team,
please take a note of the incident that we have faced today, we were travelling from Delhi to Mumbai via Goa flight. We were total four passenger and we had total four bags for check-in and two bags for hand carry in our check-in bag. We had 2 KG luggage, extra and our handbag had 3 KG less weight. But still Mr Sourav Ghosh has Not allowed us to check in the bag with extra 2 KG. He has made sure that we open the bag and transfer the luggage at the time of check-in.
I feel that was not fair with us because we didn’t had a handbag extra. Only the check-in baggage was 2 KG extra, so he could have been adjusted the weight, but he did not do that and made us trouble opening each and every bag and take out the luggage.
this was the worst experience what we had so from next time onwards we definitely need to think about if we want to travel by air express or no?
and I would definitely not recommend this Fly to anyone as the ground staff is very much rude with the customers. They have no language to talk to the customers. They are not at all cooperative with passengers.
Don’t travel by Air india Express…",Domestic,1.0,December 2024,19 January 2025,N/A,N/A,N/A,1.0,1.0,N/A,1.0,N/A
The worst flight ever - expect major delays!,Harsha B,Dubai - Jaipur,The most unprofessional flight staff and overall experience was just horrible. Flight delayed by an hour and then in taxi after landing for 1.5 hours!,International,1.0,January 2025,18 January 2025,N/A,N/A,N/A,N/A,N/A,N/A,N/A,N/A
Third class service,Voyage55868779981,Mumbai - Bengaluru,I did not have any issue coming from Bangalore to Bombay. But in BombayAirport  the checkin staff was very rude and she charged 1400/-  and offered me non reclining emergency row and she said seats were not available and in flight they have drawn marks on Shah Rukh Khan's face they are hiring school kids rather than graduates pathetic Airline,Domestic,1.0,December 2024,18 January 2025,N/A,N/A,N/A,N/A,N/A,N/A,N/A,N/A
worst flight experience of my life.,Sumit Verma,New Delhi - Bengaluru,"I have recently took flight from Delhi to Banglore and It was worst flight experience of my life.
As luggage counter was closed half an hour before boarding starts, I couldn't put my trolly in luggage. 
There staff was ill mannnered and misbhaving with every passenger.
They charged me Rs 800 Per Kg and after they didin’t allow me to take that trolly to the cabin instead they took my trolley and put in luggage section.
Also Flight was in bad condition.
I had expeience of local bus which could somehow fly.
I am not gonna travel ever again on this flight",Domestic,1.0,November 2024,17 January 2025,2.0,1.0,1.0,1.0,1.0,1.0,1.0,1.0
