title,reviewer,travel_root,text,flight_type,rating,travel_date,reviewed_Date,Legroom_rating,Seat comfort_rating,In-flight Entertainment,Customer service,Value for money,Cleanliness,Check-in and boarding,Food and Beverage
Appreciating good staff,Avijit Das Patnaik,Bengaluru - Singapore,"AI Express is a budget airline so one must compare it today with Jet Airways or Indigo flying on the same route. I had a lovely checkin experience at Blr where although the queue was long, my man Chaitanya Charan Mahapatra ensured I get a seat with next two seats empty so that I can sleep. Also my suitcase lock wasn’t functioning so he went out of his way and got a strong string tied to the zipper handles & then sealed with a sticker so that no one opens it and I feel safe. Plus had a smile on his face.

Flight was take off was smooth, seats were better than Indigo, food was better than jet airways. In my order of preference amongst these three, Jet will be last.

You can read more about my Budget travel tips in my Book ‘Scissors Paper Stones - A Budget travel guide’ available in Amazon & Kindle.",Southeast Asia,5.0,February 2019,15 February 2019,4.0,4.0,1.0,4.0,5.0,N/A,N/A,N/A
Good Experience with small flaw,Siddharth D,Chennai (Madras) - Singapore,Flight was good. On time. Served Free Food. ONLY THING THAT NEEDS TO IMPROVE IS CLEAN WASHROOMS AND MAKING FACILITY OF WEB CHECK IN. They only have counter check in which may end up standing in queu for longer time.,Southeast Asia,4.0,February 2019,14 February 2019,N/A,N/A,N/A,N/A,N/A,N/A,N/A,N/A
Horrible,MATHEWS S,Kochi (Cochin) - Dubai,"They make there most money by weighing hand baggage and checked baggage with 0.01 Kg precision. They made us throw 4 Kg , inspite of not having a hand bag. 
Meal is not so great.
Price is sometimes higher than Full Flight Service providers ( Like jet airways, emirates)

Currently check

DXB - COK July 2019 to Aug 2019 and see the price difference between Emirates and Air India Express. (Emirates is cheaper )

Air India express provides only 20 Kg baggage and very strict about hand baggage.

Food is chips and may be a wet samosa , with no ketchup.
But gives milk powder with Black tea for free.

Over all Satisafctory , but need to reduce their fares as now emirates has been cheaper than IX",International,2.0,August 2018,7 February 2019,2.0,2.0,1.0,3.0,2.0,2.0,1.0,2.0
very pathetic service,p_Pooja10,Amritsar - Dubai,"Very pathetic service of air india express in every way. Below are the points 
1. After booking tge ticket from their portal, there was no one to clarify any query. Call centres doesn’t pick up the call. Tried dialing both indias and dubais office- no response
2. The flight got delayed by more than 7 hours. The total time it takes to reach dubai is 3 and half hours and total time to wait is 9 hours as people reach early too for international flights
3. No proper meals given to passengers. some sandwiches and a sugared drink was only offered. What about patients with diabetes. What about unlimited water. A water bottle at airport cost around 60 to 100 inr. 
4. No staff to resolve queries of passengers stranded at airport. 
5. No one either at call center or office picked up passengers call. At last it is an airline by corrupted management. So nobody cares
I would advice not to book this airline until and unless its ceey urgent.",International,1.0,January 2019,31 January 2019,N/A,N/A,N/A,N/A,N/A,N/A,N/A,N/A
Poor service,HAROLD99,New York City - New Delhi,No amenities at all.  Poor food.   of the 6 bathrooms available only 3 were working.  Stewardesses were overwhelmed and not especially friendly.   Movie options were pathetic and nothing else worked,International,1.0,January 2019,28 January 2019,N/A,N/A,N/A,N/A,N/A,N/A,N/A,N/A
"Flight delayed ,Great  mindful service by Airindia express  team and Oman airports",AjayGV13,Muscat Governorate - Kochi (Cochin),"Hello

I was scheduled  to have fly out of Oman to Kochi on 14 the January 2019 by AirIndia express IX 442 which was delayed owing to technical snag .the flight which was scheduled to leave at 11.20 am went on getting delayed for hours on end .

I was quite astounded to note the special care and concern taken by the omana eiways ground handling staff , air India express team - country manager - mahesh , rafath , Oman airports team - All of then exceptionally took special care to make all passengers comfortable and supported all guests with  basic amenities .

Wish to congratulate a team who took control and responsibility of the situation and did all they could to make passengers comfortable 

Special mention goes to Azzan alwaihibi ( ground handling staff ) who stood all day with passengers even without food - until 10.00 pm till all passengers were accomodated .

Special need passengers were given special care and AirIndia ( mr Mahesh , rafath and team ) was exceptional in there support and genuine efforts.

Congratulations to all on how you managed an incident which could have been mishandled and could have created bad reputation 

'Things could go wrong , it is always how you manage it ' that determines the result

Felt I must acknowledge the sincere efforts of all the staff of AirIndia express ,Oman airports who went all the way to manage the situation perfectly well.

Congrats

Regards

Ajay George Varghese

CEO

Bipha Ayurveda

India",International,3.0,N/A,27 January 2019,2.0,3.0,3.0,5.0,3.0,N/A,N/A,N/A
AirIndia express-A Horror Movie-Doha to Mumbai,abhishekdey2015,Doha - Mumbai,"AirIndia wasn't my first choice of airline.Usually, when looking for airlines to fly, I'm searching up and down the list of consumer-aviation from Qatar. This trip was mostly like a horror movie. The start-Flight was precisely 1 hour late on 11th Jan 19 (AI9002). Was Quite patient with the waiting time. Then it all started. Here’s the list of flaws: Poor Hygiene in the washroom. No head napkin/hygiene cloth on top of the seat(absolutely unacceptable as lot of people might carry dandruff etc..). Dinner- A nightmare and I must elaborate with complete respect by saying Management is least bothered with regards to the quality of food, NO EXPIRY DATE LABEL on food(Absolutely unacceptable.It’s simply criminal). Pictures attached. Asked the staff and all that they have to say is “It’s our standard”. I replied “ It’s my right to know the manufacturing date and the date of expiration”. Eyebrows up and rolling eyes is all I got. Staff looked helpless as they had no answer and hid themselves behind the curtain and never came out to clarify further. 
I request the management to please read this very seriously and change if not improve immediately the way of operations. It’s my right to have a great experience leave beside the money paid for the ticket. I do not expect a Qatar Airways service but at least please try and get close to them to make all happy who chooses you. Take customers seriously Please !! 
On the contrary the flight from Mumbai to Kolkata was excellent. Professional staff. Good Breakfast (Again label missing). Honestly this flight made some good service recovery. Thanks !!

Abhishek Dey
+919674757124",International,1.0,January 2019,20 January 2019,N/A,N/A,N/A,N/A,N/A,N/A,N/A,N/A
Good Experince,rohit c,Abu Dhabi - New Delhi,Pretty comforting to fly in Air India Express. Only drawback is  the long line for check in and then the boarding. May be they need to add onto the counters and announce boarding section wise. Flight was on time and excellent. The cabin crews were good and hospitable and looked after the guests well.,International,5.0,December 2018,16 January 2019,N/A,N/A,N/A,N/A,N/A,N/A,N/A,N/A
Bullsheet customer service,NANJE YACHTS DUBAI,Dubai - Mangalore,Kindly request to all coustomers dont go with air india flight from dubai to mangalore ...becouse with me hand bag bellow 6 kg and they asking me money without receipt in dubai gate f 1 ( 12 pm flight on 16.01.2019 ) and i strongly fight with them then they realise me....i am travel each 2 month to india so no more with air india and dont to also all ...thanks,International,1.0,N/A,15 January 2019,1.0,1.0,1.0,1.0,1.0,N/A,N/A,N/A
Good flight with 25 kg allowed,Chandresh Parmar,New Delhi - Surat,"i like this airlines because of  flight allowed 25  luggage in economy class  plus hand baggage . 
offer good breakfast at no  extra cost .",Domestic,4.0,September 2018,15 January 2019,3.0,4.0,2.0,4.0,4.0,4.0,5.0,4.0
Seat Comfort. Customer Service. Value for Money. . Check-in and Boarding.,midhun k,Kochi (Cochin) - Abu Dhabi,"on time and comfort flight ,    Seat Comfort. Customer Service. Value for Money. need to clean properly. Check-in and Boarding.",International,3.0,September 2018,11 January 2019,N/A,N/A,N/A,N/A,N/A,N/A,N/A,N/A
Air India - the nightmare,Nihal gupta,New Delhi - Mumbai,"My flight was supposed to depart from Delhi to Mumbai at 4am on 12th Jan, 2019 but they firstly delayed it to 7am and then to 8am..I had my exam at 9am and because of air India, I missed my exam and will waste one full year for re-examination. Moreover, there was no staff available to contact to at the boarding gates. As per airlines rules, they should have provided me with free meal and room for overnight stay at the airport but no one listened to me and I had to suffer while night.. Guys I will recommned you to never travel via Air India whatever the emergency is.. I rate them 1/10 and will be shut down very soon for their behavior and service with customers",Domestic,1.0,January 2019,11 January 2019,N/A,N/A,N/A,N/A,N/A,N/A,N/A,N/A
Budget airline for international travel,Karthik K M,Mangalore - Dubai,"Good service and must improve a little 
Nice response from air hostess
This is best for budget travel for international trips",International,5.0,January 2019,7 January 2019,5.0,5.0,4.0,5.0,5.0,N/A,N/A,N/A
The services of Air India Express,Hajarah Ahamad,Singapore - Chennai (Madras),The food and service have to improve and they should have LED screen to watch programmes. When I took the flight back to Singapore I was didn't have any food being served the passenger beside me was given food. I simply don't understand the logic here .I and he have the same flight and seat and he and his family being served whereas I don't have any food being served.,Asia,1.0,December 2018,6 January 2019,1.0,2.0,1.0,1.0,1.0,3.0,4.0,1.0
Cost Effective comes at a price,Anup C,Abu Dhabi - Thiruvananthapuram (Trivandrum),Customer Service is extremely poor and but it is a cost effective travel solution to India. The on-time performance is improving,International,4.0,August 2018,3 January 2019,2.0,1.0,1.0,1.0,4.0,2.0,2.0,4.0
Budget Airlines at Best,Sumit,Dubai - Mumbai,"Traveled for 1st Time by Air India Express (as it was the cheapest during the festive season). I had already low expectations so to my surprise the flight was good considering the Budget Airlines. 1) Baggage allowance was 30 kgs from Dubai to Mumbai 2) Complimentary Snacks on board  3) Flight was on time without any delay.
The only drawback was on return from Mumbai to Dubai the baggage allowance was only 20kgs which is very less.
Overall experience was good.",International,3.0,December 2018,29 December 2018,2.0,3.0,N/A,4.0,4.0,2.0,4.0,3.0
WHY Very Good?!!!,Sivabalamurugan S,Abu Dhabi - Thiruvananthapuram (Trivandrum),"They give 30kg baggage allowance in a low cast 
If you dont have much luggage wait for at least last day of departure or 1 day prior to departure you will get surprisingly very huge low cast ticket price with 20kg baggage
So very good for the price for our budgets
Quality of service ok
Dubai to Thiruvanathapuram flight most of the time delayed by 4 HOURS!!!!!!!",International,5.0,December 2018,28 December 2018,3.0,3.0,1.0,3.0,5.0,2.0,3.0,5.0
Totally Indian Feel,TheRock,Dubai - Pune,"The flight gives a total Indian feel, as the flight crew and the boarding crew, does not give the extra effort or takes efforts to make the flight better. They do their job like and Government Office. Food and Seating quality, comfort was average. Has okay value for money. Does not have the WOW effect on the travel.",International,2.0,June 2018,17 December 2018,4.0,4.0,2.0,3.0,3.0,5.0,4.0,2.0
Awesome,Apple F,Dubai - Goa,"We chose to fly via Air India because the airport is just here in dxb and of course the ticket is cheaper. We weren’t sure if there’s food as it’s budget. But we were shocked when they served us and it was one of the tastiest biryani i’ve eaten in flight, I heard they were tied up with Taj Hotel hence the good food. Our flight were on time to and from. We didn’t loose any baggage like what I’ve been told from the experiences of my Indian colleagues and friends. Overall it was a good experience and I will fly Air India again.",International,4.0,November 2018,17 December 2018,N/A,N/A,N/A,N/A,N/A,N/A,N/A,N/A
Direct flight. Ontime.,venkat s,Singapore - Madurai,"Direct flight fro singapore to madurai has been a pleasent experience with airindia express.
timely checkin and timely arrivals",Asia,5.0,December 2018,17 December 2018,N/A,N/A,N/A,N/A,N/A,N/A,N/A,N/A
Don't trust the negative reviews,Husain K,Mumbai - Sharjah,Contrary to the negative reviews my experience with my family was really nice. The condition of the flight was good and  well according to the price of the tickets. Considering it is a budget airline the service was really good and the food was average. All in all the bad reviews seems like a few unhappy customers exacting revenge upon the airline.,International,4.0,December 2018,15 December 2018,N/A,N/A,N/A,N/A,N/A,N/A,N/A,N/A
Similar to a Bus journey,Lovesoulfulfooding,Dubai - Mumbai,"The meals(dinner) provided was absolutely not a full meal but snacks. The leg space was very limited, 
even the air conditioning was not working. People were figiting wid the buttons to get the cooling.
Only two lavatories are available, n not clean.
Seats were not comfortable as a flight standards. Our experience was very similar to traveling in  public bus or train. 
The flight was 1houe delayed, n even the landing was very bad.",International,2.0,N/A,13 December 2018,2.0,2.0,1.0,3.0,2.0,N/A,N/A,N/A
A good flight,Sudheer Ahamed,Kozhikode - Thiruvananthapuram (Trivandrum),"Air India express is the budget wing of Air India . Air India is often subject to bad reviews and complaints from its customers; however I was in for a very different experience. From the most helpful ground staff at Calicut airport who selflessly aided my fellow passenger with a knee problem , to the most courteous check in staff who greeted with a mind filling namaste to a clean flight with attentive staff . The whole experience was seamless , comfortable and in fact pleasurable. Having flied with other budget airlines in Australia and UK , I have no hesitation to say that Air India express service was definitely a notch above the rest",Domestic,5.0,N/A,13 December 2018,4.0,4.0,3.0,5.0,5.0,N/A,N/A,N/A
Poor service in general,Vagabond Engineer,Mumbai - Doha,"A full is meal is provided, the leg space is less. The seating is in a 3-3 arrangement. The staff is unresponsive but the fare was the cheapest available on the day. Would book the same flight again considering the short distance and the price.",International,4.0,December 2018,13 December 2018,2.0,2.0,1.0,2.0,3.0,3.0,3.0,4.0
Uncomfortable,mohamedfakrudeen,Sharjah - Tiruchirappalli,It is not happy to fly in Air India Express no entertainment inside the flight at least music not there and the food was very low quality food inside the plane seating capacity was more that's why all the passengers I cannot sit properly and the cushion was not soft the cushion cover is not made by cloth is made by leather after sitting 15 30 minutes under the seat is itching if they make more comfortable lot of people will fly in Air India Express the very important food and sitting comfortable the price was actually good,International,2.0,December 2018,11 December 2018,N/A,N/A,N/A,N/A,N/A,N/A,N/A,N/A
So unpleasant,Sonia J,Singapore - Coimbatore,"The service was extremely slow and poor
And they don’t care about customers 
Because it’s budget they can’t treat customers like that it would be better if they increased prices",Asia,1.0,December 2018,8 December 2018,N/A,N/A,N/A,N/A,N/A,N/A,N/A,N/A
Extremely Budget Airlines,Pavan Puligedda,Mumbai - Dubai,"An extreme budget airlines to fly to Dubai. The cheapest option available was AirIndia Express when we booked our flight to Dubai.

The airlines is a subsidary of Air India but is nothing like an international flight. It was just like a normal domestic flight and there wasnt even a magazine to read. Worst of all the u cant even gain flying points of Air India if u are flying through Air India express.

In Dubai, the Air India counter is in T1 but the Ir India Express counter is in T2. 

I would not recommend Express unless u have no other cheaper option",International,2.0,December 2018,6 December 2018,N/A,N/A,N/A,N/A,N/A,N/A,N/A,N/A
Good experience,Anindita B,Chennai (Madras) - Ahmedabad,"I always prefer Air India, the National Air line. It has a class and nostalgia value too. The air hostess cooperative.",Domestic,3.0,November 2018,27 November 2018,4.0,4.0,1.0,4.0,3.0,3.0,4.0,3.0
Average,alokbali,Mumbai - Dubai,Flight was delayed by an hour.The cabin had an unpleasant smell.Service was super fast.Snacks were hot and delicious.Overall it was an average experience.,International,3.0,October 2018,20 November 2018,N/A,N/A,N/A,N/A,N/A,N/A,N/A,N/A
Worst service and time management,Kris R,Madurai - Chennai (Madras),Airlines is least bothered about on time departure .... No time management and staff were not able to confirm the right time of departure inspire of 5 times reschedule times sent via SMS.  I would never recommend this flight,Domestic,1.0,N/A,19 November 2018,1.0,1.0,1.0,1.0,1.0,N/A,N/A,N/A
Low cost,baumwolle1963,Coimbatore - New Delhi,The flight took off on time and landed as promised . Had hassle free flight. Seats were very old with broken arm rests and seats could not be adjusted.,Domestic,4.0,November 2018,14 November 2018,4.0,4.0,4.0,4.0,4.0,3.0,4.0,4.0
The usual low cost airline,OnAir27147483715,Mumbai - Dubai,"- On time 
- Okish leg room, justified for a low cost airline
- Light snack with tea and coffee
- Nothing to complain in the service

Overall, your regular low cost airline with no issues",International,3.0,October 2018,12 November 2018,3.0,3.0,1.0,4.0,5.0,5.0,4.0,3.0
Pathetic - an understatement,Sanjay & Anisha,Sharjah - Mumbai,"Terrible. Its been a biggest regret to take Air India express with kids. We boarded from Sharjah and flight was less than 50% occupied. Upon asked (twice) for a blanket for my child, attendant (Sachin) who was absolutely disinterested and lacked empathy informed that they are short of blankets. In a 50% occupancy flights there were no blankets for kids and Sr. Citizens. Poor service, dripping of arrogance, landed & waited for 45 mins for ground staff, the list is endless. 

Utter waste of taxpayers money in AI",International,1.0,November 2018,10 November 2018,N/A,N/A,N/A,N/A,N/A,N/A,N/A,N/A
VERY BAD,Fearless359984,Singapore - Chennai (Madras),"On 28th Oct 2018 I had a flight to from Singapore to Chennai PNR XVWNOZ. The flight was delayed by 8 hours which causes substantial financial loss to me. 
I was misguided by air India express representative that in Chennai Air India express personnel will help me catch my next flight and arrangement must have been made.
This is because i booked flight from Singapore to Bhubaneswar directly. Yatra ref 1009870115792. I had a connecting flight at 6.40 am on 28/10/2018 which I missed for delay of airIndia express.

When I reached Chennai the airIndia express official told me to go to domestic departures to INDIGO counters and told that they will look after my flight.
To my utter surprise the Indigo official demanded 44000 rupees extra for arranging a flight from Chennai to Bhubaneswar.
As I didn't have any other alternative I paid the amount.",Asia,1.0,November 2018,8 November 2018,N/A,N/A,N/A,N/A,N/A,N/A,N/A,N/A
Flight service from Dubai to Mumbai,kirits310,Dubai - Mumbai,"Flight was tight. But departed in time. Staff on board were very friendly. Good refreshments. Touchdown was extremely smooth and before time arrival.

Keep it up Air India.. 

Kirit",International,4.0,October 2018,4 November 2018,N/A,N/A,N/A,N/A,N/A,N/A,N/A,N/A
Honestly a very nice experience with Air India,Seaside821793,Chennai (Madras) - Dubai,"First and foremost, the flights are punctual and Takeoff / Landing are pretty smooth, shows Air India has finest pilots in the World. Amenotoes and Dinner are good, could have been little better. Though most of the Crew are good, still few people need to learn the etiquettes of customer service, even the young crew members are with prejudice and harsh sometimes. THough it is not for me, I have witnessed the same.",International,4.0,October 2018,21 October 2018,N/A,N/A,N/A,N/A,N/A,N/A,N/A,N/A
Very bad,mohamedfakrudeen,Sharjah - Tiruchirappalli,From Sharjah to Tiruchirapalli Air India Express very bad Airlines inside the flight smelling ‏and seat was very very small not comfortable to travel I see this things more than 10 years nothing change no improvement when we are sitting inside the flight 3 people very difficult to go outside for toilet because the saetu very close no space and seat was very very very small,International,2.0,N/A,19 October 2018,1.0,1.0,1.0,2.0,2.0,N/A,N/A,N/A
Utterly hopeless!,Harshad Desai,Pune - Dubai,"Sheer nonsense!

Delay in departure (More than 60 min)

Moreover the pilot blamed it on the ""Weather"" for the delay.

The flight was already delayed by 40 min (After that the weather factor kicked in).

No co-ordination at the check-in counters.

Same individuals were being booked on the same seats creating arguments.

Seat selection never worked on the website (Checked multiple times)

After finally getting in touch with the support team (They tell me that it's just a temp outage), whereas, I was checking from 20+ days.

Honest opinion - AVOID THIS FLIGHT AT ALL COSTS!",International,1.0,September 2018,18 October 2018,1.0,1.0,1.0,1.0,1.0,1.0,1.0,1.0
Disappointing and very Crude,Setu M,Coimbatore - New Delhi,"Very uncomfortable flight! The cabin staff though very courteous and helpful, is very crude. it really felt like travelling in 2nd class train! Which airline serves Bread Jam as snacks on flight? And they have no tea or any beverage.Whatever be the reason, as a customer if I am flying, and Example: in the middle of air you tell me coz we were returning from Singapore so we could not refuel and now evacuate into the sea- how fair is that???
And where are the co passengers not told off if they play loud cheap bollywood songs on mobiles!!! 
Not Travelling on this again for SURE!",Domestic,1.0,October 2018,14 October 2018,3.0,3.0,1.0,3.0,3.0,3.0,4.0,1.0
First time on air India express,Piush P,Kathmandu - Ahmedabad,This was the first time on an Air India express from Nepal via Delhi to Ahmedabad and can truly say that it was a hassle free flight and on time.Refreshments and snacks too did not disappoint and great smartly dressed staff.If ever again in India my first choice will be AI express as I usually fly AI from London to Ahmedabad direct.,Asia,5.0,September 2018,14 October 2018,N/A,N/A,N/A,N/A,N/A,N/A,N/A,N/A
Never go for Air India Express,BackPacker823478,Dubai - New Delhi,"Never ever go for Air India express , Air condition doesn't function, one actually sweat in the flight, flights are not at all cleaned, maintained, snacks they offer looks stale. Food trays are broken, seats are torn. Booked this flight only due to convenient timings and it was the biggest mistake. Still regret why i went for Air India Express , should have read reviews before booking the flight.. AIR INDIA Express a sure shot NO, not even for free",International,1.0,September 2018,9 October 2018,2.0,1.0,1.0,1.0,1.0,1.0,1.0,1.0
"Good flight, value for money",NK S,Dubai - New Delhi,"It was good flight from Dubai to Delhi, surprisingly served food also in the no frill flight... and in flight service was good... only too rigid on hand bags weight",International,3.0,October 2018,9 October 2018,3.0,3.0,1.0,3.0,5.0,3.0,2.0,3.0
third class and really a disgrace.,Mayank J,Mumbai - Dubai,"third class airlines, third class service, third grade maintenance and overall a big mistake by travelling on this airline.",International,2.0,September 2018,2 October 2018,3.0,3.0,1.0,2.0,1.0,1.0,1.0,2.0
Above expectation,safeerpala,Mangalore - Dubai,"I have gone a visiting on feb-18.From manglore to dubai.As I heard from regular travelling(twice in two year :))friends that its like our normal transport buses.But I didnt feel like that.seating is mm ok,service was good.Totally above my expectations.",International,3.0,February 2018,27 September 2018,3.0,3.0,3.0,4.0,4.0,4.0,4.0,3.0
Moderate service Budget airline,sanprasath,Chennai (Madras) - Singapore,"When compared with other budget airlines air India express is quiet ok...
Food served also ok..
But as usual thing with air India, the flight attendants were not pleasing..",Southeast Asia,4.0,August 2018,25 September 2018,N/A,N/A,N/A,N/A,N/A,N/A,N/A,N/A
