title,reviewer,travel_root,text,flight_type,rating,travel_date,reviewed_Date,Legroom_rating,Seat comfort_rating,In-flight Entertainment,Customer service,Value for money,Cleanliness,Check-in and boarding,Food and Beverage
3rd class Air India Express,Flyer45797341092,Dubai - Surat,"The company Air India Express is a hoax. They are definitely big cheaters, in my opinion. They are robbing passengers of their money. Employees behave badly and with a great deal of arrogance. Additionally, air India Express's new website is appalling. It functions correctly the first time you book. However, it will initiate their fraudulent activities when we attempt to manage the ticket choice and alter the ticket date. TATA (tcs) is genuinely defrauding its clients if they are unable to operate a website correctly. Every fraud is always a fraud. Kindly rename the organization Tatascheating Express instead of Air India Express. Very awful staff. The level of customer service is appalling. Their servers are consistently unavailable when we contact for assistance. Expressing dishonesty. My family and I traveled frequently.

However, I've since made the decision to never use airindiaexpress for travel again. Our money and time are precious. Feeding these awful companies and their nasty people is not the goal. Spend a little bit more on other airlines and have a stress-free journey. Stay away from these thieves of money.",International,1.0,July 2024,22 July 2024,N/A,N/A,N/A,N/A,N/A,N/A,N/A,N/A
Cabin bag reunited with owner thanks to a helpful Air India Express Stagg,Voyage20819116801,Bhubaneswar - Bengaluru,"It is strange that my first public airline review is for Air India Express, and even more surprising is that it is a good one. I wanted to give a shout out to the Air India Express staff at Bhubhaneshwar airport, who helped make sure my cabin luggage, which was left by my mistake at the airport, reached Bangalore a day after I reached. A special mention goes to Preeti Paul, who was very courteous and helpful, along with the BBI lost and found staff member, Mr. Gaurav.",Domestic,5.0,July 2024,21 July 2024,N/A,N/A,N/A,N/A,N/A,N/A,N/A,N/A
Bloody bad experience,Ratheesh S,Dubai - Thiruvananthapuram (Trivandrum),Very very bad customer service and facilities they have. I would like to say don't ever take a flight with air India express.. worst of money at all. They are treated me as a begger who is travelling in their flight. I thought I am travelling on the flight without paying any money. Bloody idiots they all at airport terminal 2 in Dubai. Consider to close down the company because you are feeding donkeys. They were charged me unwanted as I logged in to online check in and went out without doing the process. What a reason it is? Give proper training to your employees how to respect the customers and behave. This will be the last flight with air India express. They are spoiling the name India. Idiots.,International,1.0,July 2024,20 July 2024,1.0,1.0,1.0,1.0,1.0,1.0,1.0,1.0
Worst experience always with express,adil m,Sharjah - Kannur,I had a booking for 20/07/2024 for IX742 from Sharjah to Kannur at 19:40. But my flight has been cancelled one day prior to the departure. I have received an email on 19 July evening which went unnoticed. But it left me without any alternate option as the flight was booked on last day of my parents visa expiry date. It is not a mistake from our end to pay a penalty of 250 each for my parents for extended stay. It has to be adjusted from the flight ticket price as it is an issue from your end. Flights are fully booked for next 2 days and now my parents are flying to mangalore with their health issues due to the your company’s irresponsible management. We have to spend for the travel from Mangalore to Kannur as well. Expecting a necessary solution and compensation from your end for this trouble caused by the inefficient service my Air India Express.,International,1.0,July 2024,20 July 2024,N/A,N/A,N/A,N/A,N/A,N/A,N/A,N/A
Unreliable service,Sam P,Kochi (Cochin) - Goa,"The flight was canceled just a few hours before the takeoff. Unfortunately, there's no one available to help with rescheduling. They inform all this over WhatsApp or email and a contact number provided over WhatsApp is constantly switched off. I had flown in from the US to attend a college reunion. The irresponsible and terrible service by AirIndia Express had left me in a helpless situation and I have decided to avoid Air India Express at any cost. Please be careful before you make your booking with Air India Express.",Domestic,1.0,July 2024,20 July 2024,N/A,N/A,N/A,N/A,N/A,N/A,N/A,N/A
Delighted,Blessy28,Kochi (Cochin) - Dubai,Had a very smooth travel today on Air India Express. The airport check-in and boarding was smooth and on time. Flight was good too,International,5.0,July 2024,20 July 2024,N/A,N/A,N/A,N/A,N/A,N/A,N/A,N/A
Pathetic horrible airline,Sunshine60228849632,New Delhi - Jaipur,"This airline is the most pathetic airline. There was no compensation given for the damaged luggage and the customer care is worst. No
One responses online and the ground level staff says to do things online. It’s just the worst airline. Never travel in This flight",Domestic,1.0,July 2024,20 July 2024,1.0,1.0,1.0,1.0,1.0,1.0,1.0,1.0
Worst Experience,Rameez S,Dammam - Mumbai,"This started during the check in time with the website Issue as the ground staff in DMM wasn't able to priceedbwoth the check in as it was showing pending payment though that service wasn't purchased.As per the DACO staff AI Express website for which we have to pay and get refunded from the Mumbai office which is big hassle for us.After boarding the flight it was big surprise for me that I wasn't given the same seat which was supposed to be in the 2nd row as I have paid for it rather was directed to the 12th row. During this time, I approached several members of your staff for information and assistance. Regrettably, I encountered unhelpfulness, rudeness and lack of assistance. This behavior was particularly distressing given the already stressful circumstances of the delay.
I was asked to wait for 20mins as they wanted to reconfirm with ground staff though I showed my ticket to them.After long wait  they weren't able to provide with a acceptable solution instead they told me that i have to sit as per boarding pass even if i have paid for it. It caused me a lot of inconvenience as i was with my family. Though there were seats available in the same front row they refused to give us that seat and later after the take off they were selling that seat. Finally Station Manager arrived and instead of giving us a solution he was holding us responsible and force fully took the picture of our passport, which is against the rule of IATA. And he told us that you will be blacklisted. The lack of timely and clear communication compounded the inconvenience and left me feeling disregarded as a passenger.
Nonetheless, my recent experience has left me disappointed and frustrated.
All the details were are communicated on the LIVE chat but none of them replied yet",International,1.0,July 2024,19 July 2024,N/A,N/A,N/A,N/A,N/A,N/A,N/A,N/A
Awful experience very very bad,Dhanalakshmi N,Abu Dhabi - Kannur,Very very awful bad service😪. They are playing with our time and got delayed up to 1 day. My flight was at 9:55 pm and first got delayed to 3:45 am then 12:55 pm then AGAIN 1 :05 pm.,International,1.0,July 2024,19 July 2024,N/A,N/A,N/A,N/A,N/A,N/A,N/A,N/A
Worst flight experience,Dream47588914304,Guwahati - New Delhi,Worst flight experience. Missed my nxt connecting flight becuse this flight was delayed.Also noticed at airport that only Air India express flights were getting delayed or cancelled,Domestic,1.0,July 2024,19 July 2024,N/A,N/A,N/A,N/A,N/A,N/A,N/A,N/A
Perfect experience with Air India,Mobile50293697051,Dubai - New Delhi,"I wish to extend my appreciation to the team aboard flight AI 930 on the 18th of July 2024 from DXB to DEL. I am especially grateful to Saurabh, Rohit, Deepakshi, and Ashutosh for ensuring the smooth operation of this flight. Despite the aircraft's age, your commitment and effort were truly commendable. As the Managing Director of Yes Marhaba Holidays & more Dubai, I intend to make Air India my preferred choice for future travel arrangements.",International,4.0,July 2024,18 July 2024,5.0,2.0,1.0,5.0,2.0,2.0,4.0,4.0
Bad experience traveling in domestic flight,Nahdha W,Surat - New Delhi,"Very bad experience 

Travelled in Air India express AI 9085 - on 15th July - from Surat to Delhi.

It Started with the ground staff deducting priority payment twice from my card. 

First deduction saying he entered the wrong amount. Second deduction - I was told it’s not reflecting into their account. However, both amounts are deducted from my side and I am waiting for the refund. 

When I came to my seat - there was garbage left in the seat pockets. 
I went to the washroom and not a minute passed - the cabin crew started knocking the door loudly and non-stop  - when I opened she said it’s flight take off time !
- Okay, understandable. Although this could have been done in a polite manner.

I came back to my seat to find another passenger seated on it by the crew member! The passenger said he was sick and the crew let him take my seat !! . It was highly frustrating to see a sick passenger on my seat without even asking me once. 

When I confronted the crew, she just walked away to check with another crew and I was just standing there. 
Surprisingly, The flight started moving and I was still standing at the isle, waiting for them to resolve this. In the end they were asking me to move into other seat which was highly inappropriate and unprofessional.

However, I didn’t agree to this and got my seat back. 
During this journey I asked the crew member to bring me a cappuccino and she said we are about to land and she cannot bring it. 

We landed more than 45 mins of her saying that. 

I have travelled in many flights but this one was the worst - bad in terms of service, cleanliness, no - understanding staffs, no proper safety checks, unprofessional behavior and no prior indication for turbulence as well.",Domestic,1.0,July 2024,18 July 2024,N/A,N/A,N/A,N/A,N/A,N/A,N/A,N/A
Excellent,Meander51264817711,Amritsar - Dubai,Kajal really helped three os us to book seats together as family.she is very friendly n very supportive. Understood our requirements and gave us the convenience.,International,1.0,July 2024,16 July 2024,3.0,3.0,1.0,5.0,3.0,3.0,5.0,1.0
Fraud not giving my refund,Meander15749291688,Goa - Guwahati,This flight has cancelled my flight on 8 th July and now then refusing to pay my ticket money and they don’t respond and when I speak with there executive they talking very rudely as like an non manner and uneducated they telling me they will be cancelled my flight and they don’t pay my money they are fraud and cheat people this stupid illiterate people no manners of how to talk with there passengers and now they started to eat passengers money also . Disgusting,Domestic,1.0,July 2024,15 July 2024,N/A,N/A,N/A,N/A,N/A,N/A,N/A,N/A
Disgusting,GoPlaces38090836159,Jaipur - Mumbai,"Flight time rescheduled 17.55 date 13th July to 06.05 date 14th July, 2024, more than 12 hours delay. You people don't have the courtesy to attend my calls. Shame on you whether your flight is flying or walking? And you are not concerned about the inconvenience caused to me. What about the money I spent during this delay? Disgusting, a big Zero number to all of you",Domestic,1.0,June 2024,13 July 2024,N/A,N/A,N/A,N/A,N/A,N/A,N/A,N/A
Goa to Mumbai (I5-679) 10 hours delayed.,Yash Singh,Goa - Mumbai,"My flight which was supposed to leave at 13:50 ultimately took off at 11:50. It’s 01:45 am and I’m in the aircraft still. All this time we were made to wait at the airport by telling us we’d be flying soon. When we tried to get answers, the CISF staff was disrespectful, threatened arrest and tried to confiscate our phones physically when we tried to record their behaviour. If you value your time or have an amount of self respect. Please take any other airline, train or a bus.",Domestic,1.0,June 2024,13 July 2024,N/A,N/A,N/A,N/A,N/A,N/A,N/A,N/A
Bad experience,Dream16216699373,Kolkata (Calcutta) - Bengaluru,"Awful you are assured of a flight but no guarantee on date time and seats
Giving false promises is their forte 
Asking us to reschedule to 7 days but again no guarantee of date and time it can get cancelled anytime even 10 minutes before boarding",Domestic,1.0,July 2024,12 July 2024,N/A,N/A,N/A,N/A,N/A,N/A,N/A,N/A
Worst flight in my life,Road50464706675,Chennai (Madras) - Kuwait City,Worst flight their no ac and no one is giving respect when we entering into flight we entered in one hour back but they did not turn ac 😤 worst experience in my life,International,1.0,July 2024,12 July 2024,1.0,1.0,1.0,1.0,1.0,1.0,1.0,1.0
Awful expeteince,susan c,Jaipur - Goa,Absolutely abysmal service… still waiting on a refund after a flight which should have too 2 hours ended up taking nearly 24 !!! Please do not use this airline,Domestic,1.0,January 2024,11 July 2024,N/A,N/A,N/A,N/A,N/A,N/A,N/A,N/A
Bad experience with AC not working,Compass23633057235,New Delhi - Bhubaneswar,All passengers onboarded and it was boiling hot inside and for some reason the staff were trying to convince that after the flight take off AC will work. Thats not the case normally in other flights. There are senior citizens and many small children in the flight.,Domestic,1.0,July 2024,11 July 2024,N/A,N/A,N/A,N/A,N/A,N/A,N/A,N/A
"FRAUD DONE BY FLIGHT, PLANE DIDNT TOOK OFF AND NOT PROVIDING REFUND",Travel53648503405,New Delhi - Bengaluru,"Flight didnt take off due to technical fault, Now company is saying it took off and we cannot give refund. Doing fraud with the passengers and taking thier hard money. Never take this flight.",Domestic,1.0,May 2024,11 July 2024,1.0,1.0,1.0,1.0,1.0,1.0,1.0,1.0
Worst Airline,anoop n,Gwalior - Mumbai,Very bad experience. They take delays as it is bound to happen in India. No wonder they are worst in all aspect. For any time led travels don't even think of Air India Express,Domestic,1.0,July 2024,10 July 2024,N/A,N/A,N/A,N/A,N/A,N/A,N/A,N/A
Last minute the schedule cancelled,Dream28948595504,Kozhikode - Surat,They never following there schedule &last minute cancelling the flight. Dont select airindia express. Customer care people are also not responding,Domestic,1.0,June 2024,10 July 2024,1.0,1.0,N/A,1.0,1.0,1.0,1.0,1.0
AIR INDIA EXPRESS - a No Go Flight,Voyage49044227677,New Delhi - Kochi (Cochin),The Airlines cancelled the flight at the last minute...the next alternate flight was 12 hours later...it is very disappointing client service....writing this review so that YOU DON'T EVER BOOK ON THIS AIRLINE. I for one would NEVER after this experience.,Domestic,1.0,July 2024,8 July 2024,N/A,N/A,N/A,N/A,N/A,N/A,N/A,N/A
Do not choose AirIndia Express Ever,Vinnu,Goa - Hyderabad,Worst ever airlines in India. They cancel the flight and did not give any alternative except choosing refund. They said the next day flight was cancelled but it was scheduled and ticket price was skyrocket. They always have delayed flights. Most of their flight are delayed min by 1 hour. Decided not to fly again with Airindia Express.,Domestic,3.0,June 2024,8 July 2024,4.0,4.0,1.0,2.0,2.0,1.0,3.0,3.0
"Terrible airline,waste of money",Explorer51024175503,New Delhi - Lucknow,"My experience was terrible,I travelled with my 8 month baby alone,at check-in counter they argued for 2kg extra weight, from the way to go for boarding there were no attendant, oll passengers had to wait outside the gate in a line till whn pilot not arrived,in the flight so much conjusted, I was not able to move give feed to my baby, staff was not supportive, thy didn't help me to go for washroom nd making his food, made excuses, I asked them please provide any 2vacant seats, if possible thy said oll seats are full, I saw many seats were vacant so got shift myself with my baby nd luggage but thy didn't even help me. I didn't recommend or travel again with this terrible airline..",Domestic,1.0,June 2024,7 July 2024,1.0,1.0,1.0,1.0,1.0,1.0,1.0,1.0
The Most Horrible Experience Ever,Nickmagdxb,Hyderabad - Chennai (Madras),"The most Horrible experience ever with this airlines. They cancelled my flight few hours before the flying time mentioning that there are no other flights over the next 72 hours, so we will refund the amount. 

No flights that too domestically for 3 days..... Seriously! Are you running the flights or charters! 

Moroever, they customer service is pathetic. I bet you if get hold of them ever. I was on call for over an hour and never got hold of them. 

I became the victim, you can save yourselves.

 I AM NEVER BOOKING THIS FLIGHT EVER IN MY LIFE!",Domestic,1.0,July 2024,7 July 2024,N/A,N/A,N/A,N/A,N/A,N/A,N/A,N/A
Worst experience ever,Adventure27342010666,Bagdogra - New Delhi,"Most disgusting airline everrr!!!! I’ve never faced such inconvenience in my life,my flight got cancelled in the last moment and I had to purchase another ticket for around 20k.No assistance,no help whatsoever!!Never going to choose air India again in my life:",Domestic,1.0,July 2024,6 July 2024,1.0,1.0,1.0,1.0,1.0,1.0,1.0,1.0
Worse Airlines,GoPlaces07635608147,Surat - Jeju,One of the worse experience starts right from booking system. my Daughters middle name has automated take different. i tried to change it nothing happened.. it took 4 hour on call but no buddy pick call.. they say happy customer executive.. only executive  are happy as they need not have to pick up call and just take salaries. finally i have to cancelled that ticket and rebooked it as the tickets are non refundable. the started AI service.. that was pathetic.. i never ever prefer this airlines again... worse deserve ---- (minus rating) if available.,North Asia,1.0,July 2024,6 July 2024,1.0,1.0,1.0,1.0,1.0,1.0,1.0,1.0
Delayer airline.,Traveler05016813597,Srinagar - Bengaluru,This is my second time when i m going to travel with Air India Express and both the time the flight gets delayed more than 1 hour which is really worst thing to get delayed both time. Before i went to kochi from Bengaluru and flight got delay 2 hours now tell me how u feel when u getting delay every time from only one airline.,Domestic,2.0,July 2024,6 July 2024,3.0,2.0,1.0,2.0,1.0,2.0,3.0,2.0
Worst cabin crew ever,Relax21749672787,Dubai - Kannur,"This was the worst flight that I ever took
There was nothing wrong with the plane 
It was the cabin crew
They don't know how to talk to the passengers 
They were not at all trained",International,1.0,July 2024,6 July 2024,N/A,N/A,N/A,N/A,N/A,N/A,N/A,N/A
Horrible Experience with Air India,premsagarp2016,Bhubaneswar - New Delhi,"Very Horrible experience
Delayed in taking off
Delayed in landing
AC not working Properly
Dont travel by air india
My request",Domestic,1.0,July 2024,5 July 2024,N/A,N/A,N/A,N/A,N/A,N/A,N/A,N/A
Horrible Experience not recommended,Shalima Roslyn D,Dubai - Goa,"Horrible experience 
. Flight delayed for 5 hrs
. Charged for laptop baggage 
. Most expensive flight ticket for uncomfortable experience",International,1.0,July 2024,5 July 2024,N/A,N/A,N/A,N/A,N/A,N/A,N/A,N/A
Very very very terrible. DO NOT BOOK AIR INDIA EXPRESS TICKTS.,Dream57798375102,Kolkata (Calcutta) - Bhubaneswar,Worst airline of all time.  Worst than spice jet also.   They should just stop doing business.   Very unprofessional staff.  My flight got delayed 3 times in a single day.   Mine was a morning flight.  I got to board the flight at 5.25 at afternoon.  😂.  For a 1 hour flight i had to waste my whole day.   Don’t book tickets on airindia express.  You will regret it later.,Domestic,1.0,July 2024,5 July 2024,1.0,1.0,1.0,1.0,1.0,1.0,1.0,1.0
Terrible,Resort28302192006,Thiruvananthapuram (Trivandrum) - Bahrain,Worst airline .. irresponsible .. experience was completely worst.. at least they have to be responsible. If they having any issues they have to solve and have to give a solution.. but nothing is there.. very worst and terrible experience,International,1.0,July 2024,3 July 2024,N/A,N/A,N/A,N/A,N/A,N/A,N/A,N/A
TERRIBLE TERRIBLE TERRIBLE!,Romisha P,Mumbai - Kochi (Cochin),"Booked flight for parents. The flight was delayed for 12 hours. The last flight delay update I received was at noon that it was rescheduled to 00:25. The actual thing was this. The flight came from Abu Dhabi. Which was delayed by 12:55. These people kept fooling us by giving no specific time until other passengers lost it and started fighting with staff. Only then they were informed about the flight coming from Abu Dhabi. The flight landed at 1:17 and parents boarded at 2. Then they made them sit inside aircraft for 2 hours! Ridiculous! After sitting there for 1 hour people got annoyed again and started shouting and only after that they informed that the passengers who got off are doing their immigration and are coming on board!!!! WHO OPERATES LIKE THIS!!! So the flight that was supposed to take off at 00:35, took off at 4 am. Originally flight time was 16:00. Never again!!!!",Domestic,1.0,July 2024,2 July 2024,N/A,N/A,N/A,N/A,N/A,N/A,N/A,N/A
Worst express- Air India express,Nijamudeen J,Dubai - Tiruchirappalli,Flight delayed 3 times due to operational reason. My entire family face difficulties. This is not first time happened in the DxB- TRZ sector,International,1.0,June 2024,2 July 2024,1.0,1.0,1.0,1.0,1.0,1.0,1.0,1.0
Distressing Experience,Scenic38117175949,Bengaluru - Kozhikode,"I am writing to share my recent distressing experience with your airline. Due to the sudden passing of my mother's brother on 30/05/2024, my family and I needed to travel urgently. Despite arriving at the airport 45 minutes before the 9:45 pm departure, we faced unforeseen delays.

Given the circumstances—my wife's pregnancy and our elderly family member's presence—we hoped for empathy and support. We paid a premium fare, approximately 25,000 above the standard rate, yet our situation was handled dismissively. The airline rejected every request for assistance.

I urge you to reconsider your approach to customer care, particularly during crises, to prevent further distress to passengers in need.

Flight No : IX 1132, BLR to CCJ
PNR : UYPGPX, SU9YVB",Domestic,1.0,May 2024,2 July 2024,1.0,1.0,1.0,1.0,1.0,1.0,1.0,1.0
Worst Airline Ever,Harshit P,New Delhi - Bhubaneswar,If you want to get the worst airline experience ever choose Air India Express. They have a strike of 100 in disappointing customers. Flights are almost always delayed and the customer service is just pathetic and if you look through other reviews you will know that they don't even care about it. My most recent flight was delayed for more than 7hrs and they didn't even provide a satisfactory reason for it but the night mare do not end there after that they litreally locked us in the bus taxi for more than an hour and even when people got agitated did not even bothered to give an explaination. If you have another airline option make sure that you never choose Air India Express,Domestic,1.0,June 2024,30 June 2024,N/A,N/A,N/A,N/A,N/A,N/A,N/A,N/A
Avoid booking with Air India Express,اسيف ا,Dammam - Kozhikode,"Avoid booking with Air India Express. I had made a reservation for the CCJ to DMM flight, and initially, it was delayed by 1 hour. However, the delay extended to 6 hours before the flight was eventually canceled. While they are refunding the amount for the canceled flight, they are not providing compensation for the connecting flight.",International,1.0,June 2024,28 June 2024,3.0,3.0,1.0,5.0,4.0,2.0,1.0,1.0
Pathetic Service,Travel65843738841,New Delhi - Bagdogra,Worst flight to travel. We opted for this flight first time but it's unbelievable that flight doesnt take off due to absence of one crew member. We have to wait for 45 minutes that crew member .they will never wait for passengers but first time seen that we all 80 passengers waited for crew.,Domestic,1.0,June 2024,28 June 2024,N/A,N/A,N/A,N/A,N/A,N/A,N/A,N/A
Very very horrible experience,Dreamer32465883682,Srinagar - New Delhi,"Flight delay, connecting flight to Varanasi missed,  staff at Srinagar airport lied about email has been sent and  next connecting flight been sorted and staff at Delhi airport would help with boarding the connecting flight , when reached Delhi boarding for the the flight was closed and we weren't able to get that flight also. 
Inefficient and absolutely ignorant staff at counter at Delhi airport.
Every half hour some new person occupies the seat and I had to narrate the whole story, they made me stand for 3 hrs at the desk.
As my elderly In-laws were already at Varanasi airport and waiting I was not able to take the offer insisted by the ticket counter staff to travel the following day.
After waiting for 3 hrs had to initiate for refund and bought tickets for the same day with other airlines.
Positive thing was the flight was brand new and clean and good services and staff were helpful 
No clear policy for missed connecting flight and the replacements depend on how hard one argues.
Customer care number is just ceremonial  doesn't work.
Issue is ongoing and not sure if it will be resolved to my satisfaction.",Domestic,4.0,June 2024,27 June 2024,5.0,5.0,1.0,1.0,1.0,5.0,1.0,4.0
